{
  "item": [
    {
      "name": "Account - Location - Create",
      "request": {
        "auth": {
          "type": "bearer",
          "bearer": [
            {
              "key": "token",
              "value": "BearerToken",
              "type": "string"
            }
          ]
        },
        "method": "POST",
        "header": [
          {
            "key": "",
            "value": "",
            "type": "default",
            "disabled": true
          }
        ],
        "body": {
          "mode": "raw",
          "raw": "{\"accountId\":\"accountId\",\"sessionId\":\"sessionId\",\"country\":\"United States\",\"region\":\"California\",\"city\":\"San Francisco\",\"postal\":\"94109\",\"latitude\":\"-123.423\",\"longitude\":\"123.123\",\"ipAddress\":\"12.45.67.89.0\"}"
        },
        "url": {
          "raw": "http://localhost:3000/api/account/location/create",
          "host": [
            "localhost:3000"
          ],
          "path": [
            "api",
            "account",
            "location",
            "create"
          ]
        },
        "description": "This endpoint is referred to as \"Account - Location - Create\". It uses a \"POST\" method for creating a new location entry for a specific account. Below is the detailed description of each field in this endpoint.\n\n1. **name**: This field indicates the name of this endpoint, which is \"Account - Location - Create\".\n\n2. **request**: This field contains all the necessary information required to make a request to this endpoint.\n\n3. **auth**: This field specifies the authentication method needed for this endpoint. In this case, it's 'Bearer' authentication and the token is provided as the value.\n\n    a. **type**: The type of authorization required which is 'Bearer'.\n    \n    b. **bearer**: An array containing the key-value pair for bearer token. The key is 'token' and the value is 'BearerToken'. The type confirms the value is a string format.\n\n4. **method**: The HTTP method used for the request. For this endpoint, it's \"POST\".\n\n5. **url**: The URL for the request is 'http://localhost:3000/api/account/location/create'.\n\n6. **headers**: An array that contains the key/value pairs to be sent in the header of the request. In this case, it's empty and disabled.\n   \n7. **body**: This field contains the data to be sent with the request. \n\n    a. **mode**: Specifies the mode of the body of the request. Here it is in 'raw' format.\n    \n    b. **raw**: The raw data to be included in the body of the request, described in JSON format. It contains the following keys:\n\n            - accountId: Identifies the account for which the location is to be created.\n            - sessionId: Identifies the session related to the account.\n            - country: The country of the location (e.g., \"United States\").\n            - region: The region of the location (e.g., \"California\").\n            - city: The city of the location (e.g., \"San Francisco\").\n            - postal: The postal code of the location (e.g., \"94109\").\n            - latitude: The geographical latitude of the location (e.g., \"-123.423\").\n            - longitude: The geographical longitude of the location (e.g., \"123.123\").\n            - ipAddress: The IP address related to the location (e.g., \"12.45.67.89.0\").\n\nThus, this endpoint is used to create a location entry for an account with the provided attributions in JSON format within the body of the request. The endpoint requires 'Bearer' authentication and the request is of 'POST' type."
      },
      "response": []
    },
    {
      "name": "Account - Location - Update",
      "request": {
        "auth": {
          "type": "bearer",
          "bearer": [
            {
              "key": "token",
              "value": "BearerToken",
              "type": "string"
            }
          ]
        },
        "method": "PUT",
        "header": [
          {
            "key": "Client-UUID",
            "value": "ClientUUID",
            "type": "default"
          }
        ],
        "body": {
          "mode": "raw",
          "raw": "{\"locationId\":\"f7e29500-b1a9-4d5a-a68b-23ece984b2d4\",\"sessionId\":\"sessionId\",\"accountId\":\"accountId\",\"country\":\"United States\",\"region\":\"California\",\"city\":\"San Jose\",\"postal\":\"94109\",\"latitude\":\"-123.423\",\"longitude\":\"123.123\",\"ipAddress\":\"12.45.67.89.0\"}"
        },
        "url": {
          "raw": "http://localhost:3000/api/account/location/update",
          "host": [
            "localhost:3000"
          ],
          "path": [
            "api",
            "account",
            "location",
            "update"
          ]
        },
        "description": "This endpoint is titled \"Account - Location - Update\". It gives you the ability to update the location details of a specific account. The request uses a 'PUT' method which indicates this action of modification.\n\nThe request is authenticated with a token, provided as a \"bearer\" type. The key for this authentication method is simply called \"token\" and the value it uses is named \"BearerToken\". The type of value it requires is a string.\n\nThe request URL is \"http://localhost:3000/api/account/location/update\".\n\nThe header of the request contains a \"Client-UUID\". This is a default type of key that holds \"ClientUUID\" as a value. It aids in uniquely identifying each client connection.\n\nThe request body uses the \"raw\" mode and contains all the information related to the account location to be updated. The individual data descriptions are as follows:\n\n- \"locationId\": a unique identifier for a particular location\n- \"sessionId\": a unique identifier for the current session\n- \"accountId\": a unique identifier for the specific account\n- \"country\": the name of the country of the location\n- \"region\": the name of a specific region within the country\n- \"city\": the name of the city \n- \"postal\": the postal or zip code \n- \"latitude\": the latitude coordinate for the location \n- \"longitude\": the longitude coordinate for the location \n- \"ipAddress\": the IP address of the user updating the location\n\nAll data values in the body are assumed to be strings, and as such they must be enclosed in quotes."
      },
      "response": []
    },
    {
      "name": "Account - Location - Get",
      "protocolProfileBehavior": {
        "disableBodyPruning": true
      },
      "request": {
        "auth": {
          "type": "bearer",
          "bearer": [
            {
              "key": "token",
              "value": "BearerToken",
              "type": "string"
            }
          ]
        },
        "method": "GET",
        "header": [
          {
            "key": "",
            "value": "",
            "type": "default",
            "disabled": true
          }
        ],
        "body": {
          "mode": "raw",
          "raw": ""
        },
        "url": {
          "raw": "http://localhost:3000/api/account/location/get/?locationId=locationId&sessionId=sessionId&accountId=accountId",
          "host": [
            "localhost:3000"
          ],
          "path": [
            "api",
            "account",
            "location",
            "get",
            ""
          ],
          "query": [
            {
              "key": "locationId",
              "value": "locationId"
            },
            {
              "key": "sessionId",
              "value": "sessionId"
            },
            {
              "key": "accountId",
              "value": "accountId"
            }
          ]
        },
        "description": "This data refers to an API endpoint named \"Account - Location - Get\". It deals with retrieving location related information associated with a specific user account. \n\n1. \"name\": This field refers to the name of the API endpoint. In this case, the name of the endpoint is \"Account - Location - Get\".\n\n2. \"request\": This field contains the details for making the API request.\n   \n    a. \"auth\": This section contains information related to the method of authentication. The \"type\" field indicates that a bearer token is being used for the API request authorization. The \"bearer\" array holds information about the token key and its value.\n   \n    b. \"method\": This field specifies the HTTP method to be used for the request, which is \"GET\" in this case.\n   \n    c. \"url\": This field defines the exact URL to which the request is to be sent. It contains parameters called \"locationId\", \"sessionId\", and \"accountId\". These parameters are placeholders and are expected to be replaced by actual values during the execution of the request. \n\n    d. \"headers\": This field represents the HTTP headers to be sent with the request. The \"key\" and \"value\" are left blank intentionally indicating that there are no additional headers needed for this request.\n\n    e. \"body\": This field represents the body of the request. \"mode\" field specifies that the body content type is \"raw\". However, the \"raw\" field doesn't contain any data, indicating that GET request does not require a body.\n\nRemember to replace all the placeholder values in the \"url\" with actual values before sending the request. Also, ensure that the \"token\" field under \"auth\" is updated with a valid bearer token for successful authorization."
      },
      "response": []
    },
    {
      "name": "Account - Location - Get All",
      "protocolProfileBehavior": {
        "disableBodyPruning": true
      },
      "request": {
        "auth": {
          "type": "bearer",
          "bearer": [
            {
              "key": "token",
              "value": "BearerToken",
              "type": "string"
            }
          ]
        },
        "method": "GET",
        "header": [
          {
            "key": "",
            "value": "",
            "type": "default",
            "disabled": true
          }
        ],
        "body": {
          "mode": "raw",
          "raw": ""
        },
        "url": {
          "raw": "http://localhost:3000/api/account/location/all/?sessionId=sessionId&accountId=accountId",
          "host": [
            "localhost:3000"
          ],
          "path": [
            "api",
            "account",
            "location",
            "all",
            ""
          ],
          "query": [
            {
              "key": "sessionId",
              "value": "sessionId"
            },
            {
              "key": "accountId",
              "value": "accountId"
            }
          ]
        },
        "description": "This endpoint is named \"Account - Location - Get All\". Its main function is to retrieve all the location data related to a specific account.\n\nThe request uses a 'GET' method, which implies that information is being fetched from this particular URL: \"http://localhost:3000/api/account/location/all/?sessionId=sessionId&accountId=accountId\". From this URL, we can observe that the request is being sent to an API related to account locations, on a locally hosted server (localhost) running on port 3000. \n\nTwo parameters are required in the root URL - 'sessionId' and 'accountId'. The 'sessionId' parameter is likely tied to the active session of the requester, presumably for security and tracking purposes. The 'accountId' parameter is probably related to the specific account from which all location data are required. Both of these parameters should be populated with appropriate values for this request to function correctly. \n\nBearer token authentication is utilized for this request as specified under the 'auth' section. This indicates that a token, identified by \"BearerToken\" under the bearer section would need to be provided for successful validation and subsequent execution of this request. \n\nNo specific headers are required for this request as the key-value pair under the 'headers' section is left empty and is marked as \"disabled\". \n\nThe 'body' mode for this request is set to 'raw', but since no raw input is mentioned, it is concluded that this endpoint does not need an HTTP body payload. \n\nIn Summary, to use this endpoint, one would need the two parameters 'sessionId' and 'accountId' to be correctly filled in the URL, as well as a valid bearer token to be supplied under the 'auth' section."
      },
      "response": []
    },
    {
      "name": "Account - Location - Delete",
      "request": {
        "auth": {
          "type": "bearer",
          "bearer": [
            {
              "key": "token",
              "value": "sessionId",
              "type": "string"
            }
          ]
        },
        "method": "POST",
        "header": [
          {
            "key": "",
            "value": "",
            "type": "default",
            "disabled": true
          }
        ],
        "body": {
          "mode": "raw",
          "raw": "{\"sessionId\":\"sessionId\",\"accountId\":\"accountId\",\"locationId\":\"locationId\"}"
        },
        "url": {
          "raw": "http://localhost:3000/api/account/location/delete",
          "host": [
            "localhost:3000"
          ],
          "path": [
            "api",
            "account",
            "location",
            "delete"
          ]
        },
        "description": "This endpoint is named \"Account - Location - Delete\", suggesting it is used to remove a location record associated with a certain account.\n\nAuthorization for this endpoint is provided through a bearer token. The \"key\" is named \"token\" and its \"value\" is obtained from a session ID, which is represented as a string.\n\nThe request method for this endpoint is POST. This implies that it sends data to the server to create a new resource (in this case, a deletion request).\n\nThe URL designated for this endpoint is \"http://localhost:3000/api/account/location/delete\". This is where the server listens for incoming requests. It's on your local machine, specifically, as is indicated by \"localhost:3000\".\n\nThere's an array of headers in the request where you can set additional information about the request. It currently contains a default header with empty key-value pair that is disabled.\n\nThe \"body\" section carries the data for the request. Its mode is \"raw\" which means the data is sent as is, a JSON payload in this case. The \"raw\" field contains a JSON string which includes \"sessionId\", \"accountId\", and \"locationId\". This implies that the deletion operation should target the \"locationId\" attached to an \"accountId\" within the current \"sessionId\".\n\nRecap: This endpoint deletes a location associated with a given account in the provided session, as indicated by the respective IDs in the request body. It uses bearer token authorization parsed from a session ID."
      },
      "response": []
    }
  ]
}