{
  "info": {
    "_postman_id": "0f3307d5-8fd4-4cdb-ac4f-4fb6b8ef7685",
    "name": "ActionRevoke",
    "schema": "https://schema.getpostman.com/json/collection/v2.1.0/collection.json",
    "_exporter_id": "34018343"
  },
  "item": [
    {
      "name": "Action - Revoke - Create",
      "request": {
        "auth": {
          "type": "bearer",
          "bearer": [
            {
              "key": "token",
              "value": "BearerToken",
              "type": "string"
            }
          ]
        },
        "method": "POST",
        "header": [
          {
            "key": "",
            "value": "",
            "type": "default",
            "disabled": true
          }
        ],
        "body": {
          "mode": "raw",
          "raw": "{\n    \"sessionId\": \"sessionId\",\n    \"accountId\": \"accountId\",\n    \"path\": \"/live/channel/video123\",\n    \"targetType\": \"streamer\",\n    \"targetId\": \"videoId\",\n    \"sourceType\": \"accountId\",\n    \"sourceId\": \"accountId\",\n    \"tokenAmount\": 20,\n    \"name\": \"revoke1\",\n    \"description\": \"\",\n    \"tags\": \"\"\n}",
          "options": {
            "raw": {
              "language": "json"
            }
          }
        },
        "url": {
          "raw": "http://localhost:3000/api/action/revoke/create",
          "host": [
            "localhost:3000"
          ],
          "path": [
            "api",
            "action",
            "revoke",
            "create"
          ]
        },
        "description": "### Action - Revoke - Create\n\nThis endpoint is designed to handle the action of revoking a specific resource. Below is a detailed description of the data used in this endpoint:\n\n#### Auth\n- **type**: Specifies the type of authorization required. In this case, it is a bearer token.\n- **bearer**: This section contains the authentication details.\n  - **key**: This indicates the authentication key type, which is `token`.\n  - **value**: The actual token required for the request, here represented as `BearerToken`.\n  - **type**: Indicates the data type of the token, specified as a string.\n\n#### Method\n- **method**: The HTTP method used for this request. It is set to `POST`, which is commonly used for creating new resources.\n\n#### URL\n- **url**: The endpoint to which the request is sent. In this case, it is `http://localhost:3000/api/action/revoke/create`, which suggests that this is a local development server.\n\n#### Headers\n- **headers**: This section contains any additional information sent with the request.\n  - Currently, there are no specific headers mentioned as both the key and value are empty, and the header is marked as disabled.\n\n#### Body\n- **mode**: This indicates the format of the body data. It is set to `raw`, meaning the body contains a raw JSON string.\n- **raw**: The actual content of the body that contains the parameters required for the revocation action in JSON format. Below are the details of each field:\n  - **sessionId**: The unique identifier for the session from which the resource will be revoked.\n  - **accountId**: The identifier of the account associated with the operation.\n  - **path**: The specific path of the resource being revoked, represented as `\"/live/channel/video123\"`.\n  - **targetType**: Indicates the type of target from which the resource will be revoked, in this case, it is set to `streamer`.\n  - **targetId**: The unique identifier for the specific target being revoked, represented as `videoId`.\n  - **sourceType**: Indicates the origin type from where the resource is being revoked. Here, it relates to the account ID.\n  - **sourceId**: The identifier of the source account for context, represented as `accountId`.\n  - **tokenAmount**: The amount of tokens to be considered for this revocation, which is set to 20.\n  - **name**: A name for the revoke action, provided here as `revoke1`.\n  - **description**: A space for additional details about the operation. Currently left empty.\n  - **tags**: A space for any tags that may categorize or describe this request further. Currently left empty.\n\n#### Options\n- **options**: Specifies additional options for the request body.\n  - **raw**: Indicates that the body content is in raw format.\n    - **language**: Specifies the format of the raw content, here noted as `json`. \n\nThis endpoint is crucial for managing the revocation of resources associated with an account, allowing for controlled actions within the system."
      },
      "response": []
    },
    {
      "name": "Action - Revoke - Update",
      "request": {
        "auth": {
          "type": "bearer",
          "bearer": [
            {
              "key": "token",
              "value": "BearerToken",
              "type": "string"
            }
          ]
        },
        "method": "PUT",
        "header": [
          {
            "key": "Client-UUID",
            "value": "ClientUUID",
            "type": "default"
          }
        ],
        "body": {
          "mode": "raw",
          "raw": "{\n    \"sessionId\": \"sessionId\",\n    \"accountId\": \"accountId\",\n    \"revokeId\":\"revokeId\",\n    \"path\": \"/live/channel/video123\",\n    \"targetType\": \"streamer\",\n    \"targetId\": \"videoId\",\n    \"sourceType\": \"accountId\",\n    \"sourceId\": \"accountId\",\n    \"tokenAmount\": 20,\n    \"name\": \"Farooq\",\n    \"description\": \"this is description\",\n    \"tags\": \"xyz\"\n}",
          "options": {
            "raw": {
              "language": "json"
            }
          }
        },
        "url": {
          "raw": "http://localhost:3000/api/action/revoke/update",
          "host": [
            "localhost:3000"
          ],
          "path": [
            "api",
            "action",
            "revoke",
            "update"
          ]
        },
        "description": "### Endpoint: Action - Revoke - Update\n\n#### Request Details\n\n- **Authentication**: \n  - **Type**: Bearer\n    - **Token**: A string value that represents the bearer token used for authentication, structured as \"BearerToken\". This token must be included in the header to authenticate the request.\n\n- **Method**: \n  - **PUT**: Indicates that this request is intended to update existing resources on the server.\n\n- **URL**: \n  - **Endpoint**: `http://localhost:3000/api/action/revoke/update`\n    - This is the URL where the API request is sent. It is intended for updating revocation actions.\n\n- **Headers**:\n  - **Client-UUID**: \n    - A default header that holds the client’s unique identifier. It is represented as \"ClientUUID\", and should be replaced with the actual UUID of the client making the request.\n\n#### Body Parameters\n\n- **Mode**: \n  - **Raw**: The body of the request is sent in its raw format, typically necessary for JSON data.\n\n- **Raw Content**: \n  ```json\n  {\n      \"sessionId\": \"sessionId\",\n      \"accountId\": \"accountId\",\n      \"revokeId\": \"revokeId\",\n      \"path\": \"/live/channel/video123\",\n      \"targetType\": \"streamer\",\n      \"targetId\": \"videoId\",\n      \"sourceType\": \"accountId\",\n      \"sourceId\": \"accountId\",\n      \"tokenAmount\": 20,\n      \"name\": \"Farooq\",\n      \"description\": \"this is description\",\n      \"tags\": \"xyz\"\n  }\n  ```\n  \n  - **sessionId**: A string that uniquely identifies the session. This should be populated with the actual session identifier.\n  \n  - **accountId**: A string that represents the account's unique identifier. Replace this with the actual account ID of the user making the request.\n  \n  - **revokeId**: A unique identifier for the revoke action. This should be replaced with the specific ID related to the revocation process.\n  \n  - **path**: A string that indicates the path to the resource being access, specifically intended for revocation actions, such as `\"/live/channel/video123\"`.\n  \n  - **targetType**: A string value indicating the type of target for the revoke action. It typically denotes whether the target is a user, streamer, etc. In this case, it is specified as \"streamer\".\n  \n  - **targetId**: The unique identifier for the target of the revoke action. This should be replaced with the actual target ID, which could refer to a video or user ID.\n  \n  - **sourceType**: Indicates the type of source initiating the action. This could refer to the account type, shown here as \"accountId\".\n  \n  - **sourceId**: The unique identifier for the source account. It is generally the same as the `accountId`.\n  \n  - **tokenAmount**: A numeric value representing the amount of tokens involved in the revocation. In this case, it’s set to 20.\n  \n  - **name**: A string representing the name associated with the revoke action. Here, it's \"Farooq\".\n  \n  - **description**: A detailed string providing additional context about the revoke action. In this instance, it simply states \"this is description\".\n  \n  - **tags**: A string that allows for categorization or labeling of the revoke action. The example value is \"xyz\". \n\nEnsure to replace placeholder values with appropriate real-world data before making the request."
      },
      "response": []
    },
    {
      "name": "Action - Revoke - Get",
      "protocolProfileBehavior": {
        "disableBodyPruning": true
      },
      "request": {
        "auth": {
          "type": "bearer",
          "bearer": [
            {
              "key": "token",
              "value": "BearerToken",
              "type": "string"
            }
          ]
        },
        "method": "GET",
        "header": [
          {
            "key": "",
            "value": "",
            "type": "default",
            "disabled": true
          }
        ],
        "body": {
          "mode": "raw",
          "raw": ""
        },
        "url": {
          "raw": "http://localhost:3000/api/action/revoke/get/?revokeId=revokeId&sessionId=sessionId&accountId=accountId",
          "host": [
            "localhost:3000"
          ],
          "path": [
            "api",
            "action",
            "revoke",
            "get",
            ""
          ],
          "query": [
            {
              "key": "revokeId",
              "value": "revokeId"
            },
            {
              "key": "sessionId",
              "value": "sessionId"
            },
            {
              "key": "accountId",
              "value": "accountId"
            }
          ]
        },
        "description": "{\n  \"name\": \"Action - Revoke - Get\",\n  \"description\": \"This endpoint retrieves information about a specific revoke action based on provided identifiers. It utilizes a GET HTTP method to fetch the data without modifying any resources.\",\n  \"request\": {\n    \"auth\": {\n      \"type\": \"bearer\",\n      \"description\": \"Authentication is done using a bearer token. This token must be included in the request to authorize access to the endpoint.\",\n      \"bearer\": [\n        {\n          \"key\": \"token\",\n          \"description\": \"This represents the key for the bearer token used for authentication. Replace 'BearerToken' with your actual token.\",\n          \"value\": \"BearerToken\",\n          \"type\": \"string\"\n        }\n      ]\n    },\n    \"method\": \"GET\",\n    \"description\": \"The HTTP method used for this request. In this case, it is a GET request, meaning it is used to retrieve data.\",\n    \"url\": \"http://localhost:3000/api/action/revoke/get/?revokeId=revokeId&sessionId=sessionId&accountId=accountId\",\n    \"description\": \"The URL endpoint for the request. Replace 'revokeId', 'sessionId', and 'accountId' with actual values to specify which revoke action to retrieve.\",\n    \"headers\": [\n      {\n        \"key\": \"\",\n        \"value\": \"\",\n        \"type\": \"default\",\n        \"disabled\": true,\n        \"description\": \"This section is currently empty and disabled. Headers can be added as necessary for additional request specifications.\"\n      }\n    ],\n    \"body\": {\n      \"mode\": \"raw\",\n      \"description\": \"The body of the request is set to raw mode.\",\n      \"raw\": \"\",\n      \"description\": \"Currently, no body content is needed for this GET request as it does not require additional data submission.\"\n    }\n  }\n}"
      },
      "response": []
    },
    {
      "name": "Action - Revoke - Get All",
      "protocolProfileBehavior": {
        "disableBodyPruning": true
      },
      "request": {
        "auth": {
          "type": "bearer",
          "bearer": [
            {
              "key": "token",
              "value": "BearerToken",
              "type": "string"
            }
          ]
        },
        "method": "GET",
        "header": [
          {
            "key": "",
            "value": "",
            "type": "default",
            "disabled": true
          }
        ],
        "body": {
          "mode": "raw",
          "raw": ""
        },
        "url": {
          "raw": "http://localhost:3000/api/action/revoke/all/?sessionId=sessionId&accountId=accountId",
          "host": [
            "localhost:3000"
          ],
          "path": [
            "api",
            "action",
            "revoke",
            "all",
            ""
          ],
          "query": [
            {
              "key": "sessionId",
              "value": "sessionId"
            },
            {
              "key": "accountId",
              "value": "accountId"
            }
          ]
        },
        "description": "### Action - Revoke - Get All\n\n#### Overview\nThis endpoint is designed to retrieve all revocation actions from the server. It requires a valid session ID and account ID to fetch the relevant data.\n\n#### Request Details\n\n- **Authentication**: \n  - **Type**: Bearer Token\n  - **Key**: `token`\n  - **Value**: The actual token should be prefixed with `Bearer ` followed by the token value. This is used to authorize the request and ensure that the caller has the necessary permissions to access the endpoint.\n\n- **HTTP Method**: \n  - **Method**: GET\n  - This specifies that the request is intended to retrieve information from the server rather than modifying it.\n\n- **URL**: \n  - **Endpoint**: `http://localhost:3000/api/action/revoke/all/`\n  - **Query Parameters**: \n    - **sessionId**: Represents the unique identifier for the user session. This is required to identify the session for which revocation actions are being requested.\n    - **accountId**: Represents the unique identifier for the user's account. This is required to specify which account's revocation actions are being queried.\n\n- **Headers**: \n  - A placeholder for any additional headers required by the request. In this case, the header is currently disabled and does not carry any value or key.\n\n- **Body**: \n  - **Mode**: Raw\n  - **Content**: The body of the request is empty since GET requests generally do not require a body. The raw mode indicates that no formatting is needed.\n\n### Summary\nThis endpoint allows users to fetch all revocation actions by providing a session ID and account ID. It uses a Bearer Token for authentication and follows a standard GET request structure."
      },
      "response": []
    },
    {
      "name": "Action - Revoke - Delete",
      "request": {
        "auth": {
          "type": "bearer",
          "bearer": [
            {
              "key": "token",
              "value": "sessionId",
              "type": "string"
            }
          ]
        },
        "method": "POST",
        "header": [
          {
            "key": "",
            "value": "",
            "type": "default",
            "disabled": true
          }
        ],
        "body": {
          "mode": "raw",
          "raw": "{\"sessionId\":\"sessionId\",\"accountId\":\"accountId\",\"revokeId\":\"revokeId\"}"
        },
        "url": {
          "raw": "http://localhost:3000/api/action/revoke/delete",
          "host": [
            "localhost:3000"
          ],
          "path": [
            "api",
            "action",
            "revoke",
            "delete"
          ]
        },
        "description": "### Description of the API Endpoint\n\n**Name**: Action - Revoke - Delete  \nThis endpoint is used to revoke or delete a specific action associated with a particular account session.\n\n**Request Details**:  \n- **Auth**: This section specifies the authentication method used to access the endpoint.\n  - **Type**: Bearer  \n    The authentication is done using a Bearer token, which is typically used for stateless authentication.\n  - **Bearer**:  \n    - **Key**: token  \n      This indicates that the parameter being used for authentication is a token.\n    - **Value**: sessionId  \n      The value should be replaced with the actual session identifier that grants access to the API.\n    - **Type**: string  \n      Indicates that the token is a string type.\n\n- **Method**: POST  \n  The HTTP method used for this request is POST, which is typically used to send data to the server for processing.\n\n- **URL**: http://localhost:3000/api/action/revoke/delete  \n  This is the endpoint URL where the revoke action is processed. It is hosted locally on the server running on port 3000.\n\n- **Headers**:  \n  This section is for any HTTP headers that need to be passed with the request.\n  - **Key**: (empty)  \n    No specific header keys are defined in this request.\n  - **Value**: (empty)  \n    No specific header values are defined in this request.\n  - **Type**: default  \n    The default type for this header entry.\n  - **Disabled**: true  \n    Indicates that this header is currently disabled and will not be sent with the request.\n\n- **Body**:  \n  This section includes the body of the POST request.\n  - **Mode**: raw  \n    The body is sent as raw data.\n  - **Raw**:  \n    `{\"sessionId\":\"sessionId\",\"accountId\":\"accountId\",\"revokeId\":\"revokeId\"}`  \n    The body should contain a JSON object with the following fields:\n    - **sessionId**: A string representing the session identifier for the current user session. Replace \"sessionId\" with the actual session ID.\n    - **accountId**: A string representing the account identifier that the action is associated with. Replace \"accountId\" with the actual account ID.\n    - **revokeId**: A string representing the identifier of the action to be revoked or deleted. Replace \"revokeId\" with the actual ID of the action you want to remove."
      },
      "response": []
    }
  ]
}