{
  "info": {
    "_postman_id": "ee0e75b7-89c2-47de-8e53-0cdeed478666",
    "name": "ActionShare",
    "schema": "https://schema.getpostman.com/json/collection/v2.1.0/collection.json",
    "_exporter_id": "34018343"
  },
  "item": [
    {
      "name": "Action - Share - Create",
      "request": {
        "auth": {
          "type": "bearer",
          "bearer": [
            {
              "key": "token",
              "value": "BearerToken",
              "type": "string"
            }
          ]
        },
        "method": "POST",
        "header": [
          {
            "key": "",
            "value": "",
            "type": "default",
            "disabled": true
          }
        ],
        "body": {
          "mode": "raw",
          "raw": "{\n    \"sessionId\": \"sessionId\",\n    \"accountId\": \"accountId\",\n    \"path\": \"/live/channel/video123\",\n    \"targetType\": \"videoId\",\n    \"targetId\": \"videoId\",\n    \"sourceType\": \"accountId\",\n    \"sourceId\": \"accountId\",\n    \"didShare\": true,\n    \"shareType\": \"link\",\n    \"text\": \"check this out\",\n    \"name\": \"\",\n    \"description\": \"\",\n    \"tags\": \"\"\n}",
          "options": {
            "raw": {
              "language": "json"
            }
          }
        },
        "url": {
          "raw": "http://localhost:3000/api/action/share/create",
          "host": [
            "localhost:3000"
          ],
          "path": [
            "api",
            "action",
            "share",
            "create"
          ]
        },
        "description": "### Action - Share - Create\n\nThis API endpoint allows users to create a share action for a specific target item. Below are the details for each component of the request:\n\n- **Authorization**: \n  - **Type**: Bearer \n  - **Token**: A bearer token is required for authentication. Replace `\"BearerToken\"` with an actual token string when making the request.\n\n- **HTTP Method**: \n  - **POST**: This indicates that data is being sent to the server to create a new entry.\n\n- **URL**: \n  - `http://localhost:3000/api/action/share/create`: This is the endpoint where the request will be sent.\n\n- **Headers**: \n  - Currently, there are no headers specified, as indicated by the empty key and value. The header is disabled, meaning it won't be included in the request.\n\n- **Body**: \n  - The body of the request is in raw JSON format. The following fields are to be included:\n\n  - **sessionId**: \n    - Represents the unique identifier for the user session. This should be replaced with the actual session ID when making the request.\n\n  - **accountId**: \n    - The unique identifier for the user's account. This should be filled in with the actual account ID.\n\n  - **path**: \n    - This indicates the specific path or URL of the item being shared. Example: `\"/live/channel/video123\"` describes where the video is located.\n\n  - **targetType**: \n    - Defines the type of the target being shared. In this case, it is set to `videoId`, indicating that the target is a video.\n\n  - **targetId**: \n    - The unique identifier of the target item (video) being shared. This should be replaced with the actual video ID.\n\n  - **sourceType**: \n    - Specifies the type of source from which the item is being shared; here it is `accountId`, indicating that the source is an account.\n\n  - **sourceId**: \n    - The unique identifier of the source entity (account) that is sharing the target item. This should correspond with the actual account ID.\n\n  - **didShare**: \n    - A boolean value indicating if the item has been shared. Set to `true` if the share action is being performed.\n\n  - **shareType**: \n    - Indicates the type of share being executed. In this case, it is set to `link`, meaning that a link to the target item is being shared.\n\n  - **text**: \n    - A message that accompanies the share. This is usually a description or comment about the shared item (e.g., `\"check this out\"`).\n\n  - **name**: \n    - An optional field for the name associated with the share. This can be left blank if not used.\n\n  - **description**: \n    - An optional field to provide more context about the share. This is also left blank if not applicable.\n\n  - **tags**: \n    - An optional field for including any relevant tags associated with the share. These might help categorize or describe the content of the share.\n\nThis endpoint is essentially designed to facilitate sharing actions on various types of content, with the ability to specify who is sharing, what is being shared, and additional context about the share."
      },
      "response": []
    },
    {
      "name": "Action - Share - Update",
      "request": {
        "auth": {
          "type": "bearer",
          "bearer": [
            {
              "key": "token",
              "value": "BearerToken",
              "type": "string"
            }
          ]
        },
        "method": "PUT",
        "header": [
          {
            "key": "Client-UUID",
            "value": "ClientUUID",
            "type": "default"
          }
        ],
        "body": {
          "mode": "raw",
          "raw": "{\n    \"sessionId\": \"sessionId\",\n    \"accountId\": \"accountId\",\n    \"path\": \"/live/channel/video123\",\n    \"targetType\": \"videoId\",\n    \"targetId\": \"videoId\",\n    \"sourceType\": \"accountId\",\n    \"sourceId\": \"accountId\",\n    \"didShare\": true,\n    \"shareType\": \"link\",\n    \"text\": \"check this out update\",\n    \"name\": \"\",\n    \"description\": \"\",\n    \"tags\": \"\",\n    \"shareId\":\"shareId\"\n}",
          "options": {
            "raw": {
              "language": "json"
            }
          }
        },
        "url": {
          "raw": "http://localhost:3000/api/action/share/update",
          "host": [
            "localhost:3000"
          ],
          "path": [
            "api",
            "action",
            "share",
            "update"
          ]
        },
        "description": "### Action - Share - Update\n\nThis API endpoint allows users to update sharing details for specific content.\n\n#### Request\n\n- **Auth**:\n  - **Type**: Bearer\n    - **Bearer Token**: The token required for authorization to access this endpoint. The token should be supplied in the format: \"Bearer <token>\".\n\n- **Method**: \n  - **PUT**: This HTTP method is used to update existing resources on the server.\n  \n- **URL**: \n  - **Endpoint**: `http://localhost:3000/api/action/share/update` \n    - This is the endpoint where the request will be sent to perform the update action.\n\n- **Headers**:\n  - **Client-UUID**: A unique identifier for the client making the request. This helps the server identify the client and its context.\n\n- **Body**:\n  - **Mode**: Raw\n    - This indicates that the request body contains raw data in JSON format.\n\n  - **Raw JSON Data**:\n    - **sessionId**: A unique identifier for the user's session, which is useful for tracking user interactions and data sharing sessions.\n    - **accountId**: The ID associated with the user's account that is performing the sharing action.\n    - **path**: The location of the content being shared. For example, it might denote a URL path for a video.\n    - **targetType**: Specifies the type of target being shared, such as \"videoId\", indicating that the target of the share is a video identified by its ID.\n    - **targetId**: The unique identifier of the target content that is being shared.\n    - **sourceType**: The type of the source account that is sharing the content. This might be an \"accountId\" indicating the account sharing the video.\n    - **sourceId**: The unique identifier of the source account that is responsible for sharing.\n    - **didShare**: A boolean value indicating whether the share action was successfully executed. Set to true if the item was shared.\n    - **shareType**: Indicates the method of sharing, such as \"link\", specifying how the content is being shared.\n    - **text**: A custom message that can accompany the shared content. In this case, it states \"check this out update\".\n    - **name**: A placeholder for any name associated with the share, currently left empty.\n    - **description**: A space for a description of the shared content, also currently left empty.\n    - **tags**: Tags associated with the shared content for better categorization, currently left empty.\n    - **shareId**: A unique identifier for the share action itself, which could be used to track or reference this particular share operation.\n\nThis endpoint is designed for users to modify sharing details effectively, ensuring that all relevant information is captured in the request body."
      },
      "response": []
    },
    {
      "name": "Action - Share - Get",
      "protocolProfileBehavior": {
        "disableBodyPruning": true
      },
      "request": {
        "auth": {
          "type": "bearer",
          "bearer": [
            {
              "key": "token",
              "value": "BearerToken",
              "type": "string"
            }
          ]
        },
        "method": "GET",
        "header": [
          {
            "key": "",
            "value": "",
            "type": "default",
            "disabled": true
          }
        ],
        "body": {
          "mode": "raw",
          "raw": ""
        },
        "url": {
          "raw": "http://localhost:3000/api/action/share/get/?shareId=shareId&sessionId=sessionId&accountId=accountId",
          "host": [
            "localhost:3000"
          ],
          "path": [
            "api",
            "action",
            "share",
            "get",
            ""
          ],
          "query": [
            {
              "key": "shareId",
              "value": "shareId"
            },
            {
              "key": "sessionId",
              "value": "sessionId"
            },
            {
              "key": "accountId",
              "value": "accountId"
            }
          ]
        },
        "description": "### Description of Endpoint Data\n\n- **name**: This is the name of the API request. In this case, it is titled \"Action - Share - Get\", indicating that it is used for retrieving share actions.\n\n- **request**: This section contains all the necessary information for making the API request.\n\n  - **auth**: This part specifies the authentication method required to access the endpoint.\n  \n    - **type**: Indicates the type of authentication being used. Here, it is \"bearer\", which typically involves passing a token for authorization.\n    \n    - **bearer**: This array holds the details related to the bearer token.\n    \n      - **key**: This is a label for the token parameter. In this case, it is named \"token\".\n      \n      - **value**: This is where you input the actual bearer token you will use for authentication. The placeholder \"BearerToken\" is meant to be replaced with a valid token.\n      \n      - **type**: Indicates the data type of the value. Here, it is specified as \"string\", meaning the token should be a text value.\n\n  - **method**: This indicates the type of HTTP method used for the request. In this case, \"GET\" signifies that this request is meant to retrieve data from the server.\n\n  - **url**: This is the endpoint URL where the request will be sent. It includes several query parameters:\n  \n    - **shareId**: This parameter represents the unique identifier for the share you want to retrieve. It should be replaced with the actual share ID.\n    \n    - **sessionId**: This parameter is used to specify the session ID related to the request. It should be replaced with the actual session ID.\n    \n    - **accountId**: This parameter represents the unique identifier for the account associated with the share. It should be replaced with the actual account ID.\n\n  - **headers**: This section is a list of HTTP headers that may be included with the request.\n  \n    - **key**: This is intended for specifying the name of a header. In this case, it is empty.\n    \n    - **value**: This is where you would include the value for the header. It is also empty here.\n    \n    - **type**: This indicates the type of header. \"default\" means it is a standard HTTP header.\n    \n    - **disabled**: Indicates whether this header section is active or not. Here, it is set to true, meaning this specific header will not be sent with the request.\n\n  - **body**: This section holds the body of the HTTP request.\n  \n    - **mode**: This indicates how the body is formatted. \"raw\" means that the body content can be written freely in its raw form.\n    \n    - **raw**: This is where the actual data content for the request body would be specified. It is currently empty, implying that this GET request does not require a request body."
      },
      "response": []
    },
    {
      "name": "Action - Share - Get All",
      "protocolProfileBehavior": {
        "disableBodyPruning": true
      },
      "request": {
        "auth": {
          "type": "bearer",
          "bearer": [
            {
              "key": "token",
              "value": "BearerToken",
              "type": "string"
            }
          ]
        },
        "method": "GET",
        "header": [
          {
            "key": "",
            "value": "",
            "type": "default",
            "disabled": true
          }
        ],
        "body": {
          "mode": "raw",
          "raw": ""
        },
        "url": {
          "raw": "http://localhost:3000/api/action/share/all/?sessionId=sessionId&accountId=accountId",
          "host": [
            "localhost:3000"
          ],
          "path": [
            "api",
            "action",
            "share",
            "all",
            ""
          ],
          "query": [
            {
              "key": "sessionId",
              "value": "sessionId"
            },
            {
              "key": "accountId",
              "value": "accountId"
            }
          ]
        },
        "description": "### Detailed Description of the Endpoint Data\n\n- **name**: This is the identifier for the API endpoint. In this case, it is named \"Action - Share - Get All\", which indicates that this endpoint is used to retrieve all share actions available in the system.\n\n- **request**: This object contains all the properties related to the HTTP request that will be made to the API endpoint.\n\n  - **auth**: This section outlines the authentication method used when accessing the endpoint. Here, it specifies that a bearer token is required for authorization.\n\n    - **type**: This indicates the type of authentication being used. It is set to \"bearer\", which means that bearer token authentication is required.\n\n    - **bearer**: This is an array that holds the details for the bearer token.\n\n      - **key**: This represents the name of the parameter for the token. In this case, it is labeled as \"token\".\n\n      - **value**: This is the actual bearer token that will be passed in the authorization header. For demonstration purposes, it is shown as \"BearerToken\".\n\n      - **type**: This indicates the data type of the `value`. Here, it is specified as \"string\".\n\n  - **method**: This specifies the HTTP method used to interact with the endpoint. It is set to \"GET\", which indicates that this request is intended to retrieve data.\n\n  - **url**: This is the complete URL to which the request will be made. The URL provided is `http://localhost:3000/api/action/share/all/?sessionId=sessionId&accountId=accountId`, where:\n  \n    - `http://localhost:3000` is the base URL of the local server.\n    - `/api/action/share/all/` is the specific path for this API endpoint.\n    - `?sessionId=sessionId` is a query parameter for the session ID, where \"sessionId\" should be replaced with a valid session identifier.\n    - `&accountId=accountId` is another query parameter for the account ID, which should be replaced with a valid account identifier.\n\n  - **headers**: This section is for defining any additional HTTP headers that may be necessary for the request.\n\n    - **key**: In this instance, there is no key specified, meaning no additional headers are being sent with this request.\n\n    - **value**: Similar to the key, there is no value specified, so this field is left empty.\n\n    - **type**: This indicates the type of the header, which is set to \"default\".\n\n    - **disabled**: This property indicates whether the header is enabled or disabled for the request. It is set to true, meaning that this header will not be included in the request.\n\n  - **body**: This field is used to define the body of the request.\n\n    - **mode**: This specifies the format of the body. It is set to \"raw\", which indicates that the body will contain plain text.\n\n    - **raw**: This is the field where the actual body content would go if applicable. In this case, it is empty, which means there is no body content to be sent with the GET request."
      },
      "response": []
    },
    {
      "name": "Action - Share - Delete",
      "request": {
        "auth": {
          "type": "bearer",
          "bearer": [
            {
              "key": "token",
              "value": "sessionId",
              "type": "string"
            }
          ]
        },
        "method": "POST",
        "header": [
          {
            "key": "",
            "value": "",
            "type": "default",
            "disabled": true
          }
        ],
        "body": {
          "mode": "raw",
          "raw": "{\"sessionId\":\"sessionId\",\"accountId\":\"accountId\",\"shareId\":\"shareId\"}"
        },
        "url": {
          "raw": "http://localhost:3000/api/action/share/delete",
          "host": [
            "localhost:3000"
          ],
          "path": [
            "api",
            "action",
            "share",
            "delete"
          ]
        },
        "description": "### Action - Share - Delete Endpoint Description\n\n- **Endpoint Name:** Action - Share - Delete\n  - This endpoint is used to delete a shared action.\n\n- **Request Type:**\n  - **Method:** POST\n    - This endpoint uses the POST method to send a request to the server.\n\n- **Authentication:**\n  - **Auth Type:** Bearer\n    - Authentication is done using a bearer token to validate the user's session.\n\n  - **Bearer Token Details:**\n    - **Key:** token\n      - This key is used to identify the authorization token within the request.\n    - **Value:** sessionId\n      - The value represents the session identifier, which must be replaced with the actual session ID during the request.\n    - **Type:** string\n      - Indicates that the token is a string value.\n\n- **Request URL:**\n  - **URL:** `http://localhost:3000/api/action/share/delete`\n    - This is the endpoint URL where the request is sent. It is set to localhost for local testing.\n\n- **Headers:**\n  - The request currently has a header defined but it is disabled and does not contain any key or value.\n    - **Key:** (empty)\n    - **Value:** (empty)\n    - **Type:** default\n    - **Disabled:** true\n      - This indicates that no additional headers are being sent with the request.\n\n- **Request Body:**\n  - **Mode:** raw\n    - Indicates that the body of the request is in raw JSON format.\n  - **Raw Body Content:**\n    - The body contains a JSON object with the following parameters:\n      - **sessionId:** \"sessionId\"\n        - This field should contain the actual session ID for authentication.\n      - **accountId:** \"accountId\"\n        - This field should contain the actual account ID associated with the action to be deleted.\n      - **shareId:** \"shareId\"\n        - This field should contain the ID of the share that needs to be deleted.\n\nMake sure to replace the placeholder values (\"sessionId\", \"accountId\", \"shareId\") with actual values when making a request to successfully delete a share."
      },
      "response": []
    }
  ]
}