{
  "info": {
    "_postman_id": "eaf2c628-6c23-4c56-b05e-dd35c5f90485",
    "name": "IncentiveAdvertisement",
    "schema": "https://schema.getpostman.com/json/collection/v2.1.0/collection.json",
    "_exporter_id": "37471241"
  },
  "item": [
    {
      "name": "Incentive - Advertisement - Create",
      "request": {
        "auth": {
          "type": "bearer",
          "bearer": [
            {
              "key": "token",
              "value": "BearerToken",
              "type": "string"
            }
          ]
        },
        "method": "POST",
        "header": [
          {
            "key": "",
            "value": "",
            "type": "default",
            "disabled": true
          }
        ],
        "body": {
          "mode": "raw",
          "raw": "{\n    \"accountId\": \"accountId\",\n    \"sessionId\": \"sessionId\",\n    \"title\": \"Converse Shoes Campaign\",\n    \"description\": \"Promote the latest Converse shoes.\",\n    \"tags\": \"shoes,fashion,trending\",\n    \"coverPhotoUrl\": \"https://example.com/images/converse-shoes.jpg\",\n    \"websiteUrl\": \"https://example.com/converse\",\n    \"tokenAmount\": 10,\n    \"scheduleDate\": \"2024-11-25\",\n    \"scheduleTime\": \"10:00:00\",\n    \"pageType\": \"Livestream\",\n    \"city\": \"Henderson\",\n    \"region\": \"Nevada\",\n    \"country\": \"United States\",\n    \"keywords\": [\n        {\n            \"category\": \"Fashion\",\n            \"themes\": [\"Trending\", \"Shoes\"]\n        }\n    ],\n    \"category\": \"Electronics & Gadgets\",\n    \"voteButtonQuantity\": 2,\n    \"voteButtonText1\": \"Buy Now\",\n    \"voteButtonText2\": \"Learn More\",\n    \"crossPlatformBudget\": [\n        {\n            \"platform\": \"google\",\n            \"perDay\": 100,\n            \"numberOfDays\": 7\n        },\n        {\n            \"platform\": \"meta\",\n            \"perDay\": 50,\n            \"numberOfDays\": 14\n        }\n    ],\n    \"adShareSettings\": \"2 Way Split\",\n    \"isPaused\": false\n}\n",
          "options": {
            "raw": {
              "language": "json"
            }
          }
        },
        "url": {
          "raw": "http://localhost:3000/api/incentive/advertisement/create",
          "host": [
            "localhost:3000"
          ],
          "path": [
            "api",
            "incentive",
            "advertisement",
            "create"
          ]
        },
        "description": "This endpoint titled as \"Incentive - Advertisement - Create\", is used to create new advertisements in the Incentive system. \n\nIt uses the POST method and the URL for this endpoint is \"http://localhost:3000/api/incentive/advertisement/create\". \n\nThe authentication required for this endpoint is type \"bearer\", with the bearer token used as the authorization key. \n\nThe request body is in raw JSON format, composed of details related to the advertisement including:\n\n- \"accountId\" is a string representing the account identifier under which the advertisement is created.\n- \"sessionId\" is a string, which represents the session in which the advertisement is created.\n- \"title\" represents the title of the advertisement.\n- \"description\" provides a brief about the advertisement.\n- \"tags\" are specific words or phrases that describe the advertisement.\n- \"coverPhotoUrl\" represents an online URL where the cover photo of the advertisement is hosted.\n- \"websiteUrl\" is the link to the company or product's website that the ad is promoting.\n- \"tokenAmount\" represents the amount of tokens assigned to this advertisement.\n- \"scheduleDate\" and \"scheduleTime\" specifies when the advertisement should be scheduled to go live.\n- \"pageType\" describes the type of page where the advertisement will be displayed.\n- \"city\", \"region\", and \"country\" describe the location targeting of the advertisement.\n- \"keywords\" are specific words or phrases related to the theme and category of advertisement.\n- \"category\" is the overall category to which the advertisement belongs.\n- \"voteButtonQuantity\" represents the number of voting buttons in the ad, and \"voteButtonText1\", \"voteButtonText2\" are the respective button texts.\n- \"crossPlatformBudget\" is an array representing the budget allocation for different platforms over a specific number of days.\n- \"adShareSettings\" indicates how the ad revenue will be split. \n- \"isPaused\" is a boolean indicating whether the ad is currently paused or not. \n\nThe endpoint does not accept any specific header values by default. The response of the endpoint would need to be captured separately and is not included in this information.\n\nThis document helps in understanding the data within the \"POST\" request for the \"Incentive - Advertisement - Create\" API endpoint. For each specific use-case, entries in the request body may need to be modified."
      },
      "response": []
    },
    {
      "name": "Incentive - Advertisement - Update",
      "request": {
        "auth": {
          "type": "bearer",
          "bearer": [
            {
              "key": "token",
              "value": "BearerToken",
              "type": "string"
            }
          ]
        },
        "method": "PUT",
        "header": [
          {
            "key": "Client-UUID",
            "value": "ClientUUID",
            "type": "default"
          }
        ],
        "body": {
          "mode": "raw",
          "raw": "{\n    \"accountId\": \"accountId\",\n    \"sessionId\": \"sessionId\",\n    \"advertisementId\": \"advertisementId\",\n    \"title\": \"Converse Shoes Campaign\",\n    \"description\": \"Promote the latest Converse shoes 2.0\",\n    \"tags\": \"shoes,fashion,trending\",\n    \"coverPhotoUrl\": \"https://example.com/images/converse-shoes.jpg\",\n    \"websiteUrl\": \"https://example.com/converse\",\n    \"tokenAmount\": 10,\n    \"scheduleDate\": \"2024-11-25\",\n    \"scheduleTime\": \"10:00:00\",\n    \"pageType\": \"Livestream\",\n    \"city\": \"Henderson\",\n    \"region\": \"Nevada\",\n    \"country\": \"United States\",\n    \"keywords\": [\n        {\n            \"category\": \"Fashion\",\n            \"themes\": [\"Trending\", \"Shoes\"]\n        }\n    ],\n    \"category\": \"Electronics & Gadgets\",\n    \"voteButtonQuantity\": 2,\n    \"voteButtonText1\": \"Buy Now\",\n    \"voteButtonText2\": \"Learn More\",\n    \"crossPlatformBudget\": [\n        {\n            \"platform\": \"google\",\n            \"perDay\": 100,\n            \"numberOfDays\": 7\n        },\n        {\n            \"platform\": \"meta\",\n            \"perDay\": 50,\n            \"numberOfDays\": 14\n        }\n    ],\n    \"adShareSettings\": \"2 Way Split\",\n    \"isPaused\": false\n}\n",
          "options": {
            "raw": {
              "language": "json"
            }
          }
        },
        "url": {
          "raw": "http://localhost:3000/api/incentive/advertisement/update",
          "host": [
            "localhost:3000"
          ],
          "path": [
            "api",
            "incentive",
            "advertisement",
            "update"
          ]
        },
        "description": "The endpoint provides an avenue to update an existing advertisement incentive. It uses a PUT request to execute this operation. Below are the details of the endpoint and its various elements:\n\n1. **Name**: Identifies the endpoint, in this case, \"Incentive - Advertisement - Update\".\n\n2. **Request**: Contains various components for the PUT request:\n\n    a. **Auth**: The authorization required to access this endpoint, which is of type \"bearer\". It includes a token which has to be provided for access.\n\n    b. **Method**: Specifies the HTTP method used, which is PUT for updates in RESTful APIs.\n\n    c. **URL**: The endpoint's URL where the request is sent- \"http://localhost:3000/api/incentive/advertisement/update\"\n\n    d. **Headers**: Headers that have to be included in the request. Here, 'Client-UUID' is a compulsory header.\n\n    e. **Body**: Contains the detailed data for the update request. It is sent in \"raw\" mode and should follow the JSON language. \n    \n       i. The elements of an advertisement to be updated are: `accountId`, `sessionId`, `advertisementId`, `title`, `description`, `tags`, `coverPhotoUrl`, `websiteUrl`, `tokenAmount`, `scheduleDate`, `scheduleTime`, `pageType`, `city`, `region`, `country`, `keywords`, `category`, `voteButtonQuantity`, `voteButtonText1`, `voteButtonText2`, `crossPlatformBudget`, `adShareSettings`, `isPaused`. More details can be found in the request body.\n\n3. **Response**: It is not shown in the provided data, but it usually contains the data returned by the server in response to the request.\n\nPlease note that all the keys in the body are mandatory for the endpoint to work correctly. Also, some values may require specific formatting(e.g. `scheduleTime` needs the format 'hh:mm:ss' and `scheduleDate` needs the format 'YYYY-MM-DD'). Make sure to replace the placeholder values with real ones when making actual requests."
      },
      "response": []
    },
    {
      "name": "Incentive - Advertisement - Get",
      "protocolProfileBehavior": {
        "disableBodyPruning": true
      },
      "request": {
        "auth": {
          "type": "bearer",
          "bearer": [
            {
              "key": "token",
              "value": "BearerToken",
              "type": "string"
            }
          ]
        },
        "method": "GET",
        "header": [
          {
            "key": "",
            "value": "",
            "type": "default",
            "disabled": true
          }
        ],
        "body": {
          "mode": "raw",
          "raw": ""
        },
        "url": {
          "raw": "http://localhost:3000/api/incentive/advertisement/get/?advertisementId=advertisementId&sessionId=sessionId&accountId=accountId",
          "host": [
            "localhost:3000"
          ],
          "path": [
            "api",
            "incentive",
            "advertisement",
            "get",
            ""
          ],
          "query": [
            {
              "key": "advertisementId",
              "value": "advertisementId"
            },
            {
              "key": "sessionId",
              "value": "sessionId"
            },
            {
              "key": "accountId",
              "value": "accountId"
            }
          ]
        },
        "description": "\"name\" : This field specifies the name of the API endpoint. Here, it is called \"Incentive - Advertisement - Get\".\n\n\"request\" : This field comprises the details of the API request.\n\n\"auth\" : This field represents the authentication method used for the API endpoint. It uses the bearer type authentication.\n\n\"auth.type\" : Shows the type of authentication used for the request. In this case, bearer token is used.\n\n\"auth.bearer\" : It is an array of authentication information.\n   \n\"auth.bearer.key\" : Represents the specific key in the bearer token to be used for authentication, in this case \"token\".\n\n\"auth.bearer.value\" : Provides the value associated with the key used in the bearer token. The value is named \"BearerToken\".\n\n\"auth.bearer.type\" : Specifies the type of data the bearer token is, which is a string.\n\n\"method\" : This refers to the HTTP method used for the API request. Here, it is a \"GET\" method.\n\n\"url\" : This field contains the URL of the API endpoint. In this case, it is \"http://localhost:3000/api/incentive/advertisement/get/?advertisementId=advertisementId&sessionId=sessionId&accountId=accountId\"\n\n\"url parameters\" : The URL parameters in the endpoint are advertisementId, sessionId, and accountId.\n\n\"headers\" : This array holds the information for any headers to be sent in the request.\n  \n\"headers.key\" : The key for a header item. In this case it is empty.\n\n\"headers.value\" : The value associated with the key in a header item. In this case it is empty.\n\n\"headers.type\" : Defines the type of a header item. Here, it is \"default\".\n\n\"headers.disabled\" : Shows the status of a header. Here, it is set as true, which means it is disabled and won't be added into the request headers.\n\n\"body\" : This field represents the body of the request which contains the data sent to the API endpoint. For this \"GET\" request, the body is empty.\n\n\"body.mode\" : Specifies the mode of data in the body of the request. In this case, it is set to \"raw\".\n\n\"body.raw\" : Holds the raw data in the body of the request. In this case, it is empty as there is no data being sent in the body for this GET request."
      },
      "response": []
    },
    {
      "name": "Incentive - Advertisement - Get All",
      "protocolProfileBehavior": {
        "disableBodyPruning": true
      },
      "request": {
        "auth": {
          "type": "bearer",
          "bearer": [
            {
              "key": "token",
              "value": "BearerToken",
              "type": "string"
            }
          ]
        },
        "method": "GET",
        "header": [
          {
            "key": "",
            "value": "",
            "type": "default",
            "disabled": true
          }
        ],
        "body": {
          "mode": "raw",
          "raw": ""
        },
        "url": {
          "raw": "http://localhost:3000/api/incentive/advertisement/all/?sessionId=sessionId&accountId=accountId",
          "host": [
            "localhost:3000"
          ],
          "path": [
            "api",
            "incentive",
            "advertisement",
            "all",
            ""
          ],
          "query": [
            {
              "key": "sessionId",
              "value": "sessionId"
            },
            {
              "key": "accountId",
              "value": "accountId"
            }
          ]
        },
        "description": "The endpoint \"Incentive - Advertisement - Get All\" contains property details that are explained one by one as follows:\n\n\"name\": This is a title or summarizing description of the specified endpoint. In this case, \"Incentive - Advertisement - Get All,\" indicates that endpoint receives all the incentive advertisements.\n\n\"request\": This object holds the information about the various properties of the network request that we're making.\n\n  \"auth\": This specifies the type of authentication needed for the endpoint. Here, the type is 'bearer', which is a method for an HTTP client to provide a security token associated with them to the server.\n  \n    \"bearer\": An array where each object provides the key and value needed for authentication. Here the key is 'token' with the value as 'BearerToken'. The type defines the data type of value, i.e., it's a string.\n  \n  \"method\": This specifies the HTTP verb. In this case, it is a 'GET' request, which means this endpoint is used to retrieve resources.\n\n  \"url\": This is the API endpoint where the request is being sent. The 'http://localhost:3000/api/incentive/advertisement/all/' is the URL of the endpoint. \n\nTwo query parameters 'sessionId' and 'accountId' are appended to the URL. These likely aid in fetching specific sets of data related to a given session and account. \n\n  \"headers\": An array of objects where each object represents a header's key-value pair to be included in the HTTP request. In this case, it's an empty header.\n\n  \"body\": This defines the data that is sent through the HTTP request. Here, the mode is raw, which means the request is being sent as an unstructured bundle. As there's nothing in this endpoint's raw body, it's likely the data sent in body is empty."
      },
      "response": []
    },
    {
      "name": "Incentive - Advertisement - Delete",
      "request": {
        "auth": {
          "type": "bearer",
          "bearer": [
            {
              "key": "token",
              "value": "sessionId",
              "type": "string"
            }
          ]
        },
        "method": "POST",
        "header": [
          {
            "key": "",
            "value": "",
            "type": "default",
            "disabled": true
          }
        ],
        "body": {
          "mode": "raw",
          "raw": "{\"sessionId\":\"sessionId\",\"accountId\":\"accountId\",\"advertisementId\":\"advertisementId\"}"
        },
        "url": {
          "raw": "http://localhost:3000/api/incentive/advertisement/delete",
          "host": [
            "localhost:3000"
          ],
          "path": [
            "api",
            "incentive",
            "advertisement",
            "delete"
          ]
        },
        "description": "1. `\"name\"`: This is the name of your API endpoint. In this case, the `name` is \"Incentive - Advertisement - Delete\". This implies that this endpoint is used to delete an incentive advertisement.\n\n2. `\"request\"`: This outlines the details of the request made to the endpoint. It includes the authentication used, the request method, the url where the request should go to, headers if any, and the body of the request.\n\n3. `\"auth\"`: This describes the type of authentication used for this endpoint. In this case, it uses `bearer` authentication. When making a request to this endpoint, you must supply a \"token\" in the request headers. The `value` given here, \"sessionId\", suggests that you would replace this placeholder with the actual session ID for authentication.\n\n4. `\"method\"`: This is the HTTP Request method used for the endpoint. In this case, it is `POST`, meaning this endpoint is used for sending data to be processed to a resource on the server.\n\n5. `\"url\"`: This is the URL of the endpoint. It specifies where the request is sent when the endpoint is called. \n\n6. `\"headers\"`: These are additional settings included with the HTTP request. Here, no specific key-value header pairs are given, and the only listed header is disabled, meaning it won't be sent with the request.\n\n7. `\"body\"`: This contains the data that you want to send to the route. It is in `raw` format, and for this endpoint, it contains a sessionId, accountId, and advertisementId. These would usually be replaced with actual values when making a request.\n\n   - `\"sessionId\"`: The session ID which is likely used as a part of bearer \n     authentication.\n   - `\"accountId\"`: Identifier for the specific account related to the request.\n   - `\"advertisementId\"`: Identifier for the specific advertisement the request is focused on.\n\nRemember to replace \"sessionId\", \"accountId\" and \"advertisementId\" in the request body with actual values when using this endpoint."
      },
      "response": []
    }
  ]
}